{
  "$schema": "../schema/chat-schema-0.4.json",
  "version": "0.2",
  "engine": "chat-bison",
  "examples": [
    {
      "role": "user",
      "content": "1+1"
    },
    {
      "role": "assistant",
      "content": "=2"
    }
  ],
  "messages": [
    {
      "role": "user",
      "content": "2*4"
    }
  ],
  "parameters": [
    {
      "name": "temperature",
      "value": 0.1
    }
  ]
}
