{
  "$schema": "../schema/chat-schema.json",
  "version": "0.3",
  "engine": "chat-bison",
  "messages": [
    {
      "role": "user",
      "content": "What is the weather today in Beijing?"
    },
    {
      "role": "assistant",
      "function_call": {
				"name": "get_weather",
				"arguments": "{\n\"city\": \"Beijing\",\n\"time\": \"today\"\n}"
			}
    },
    {
			"role": "function",
			"name": "get_weather",
			"content": "{\"weather\": \"sunny, 25C\"}"
		}
  ],
  "parameters": [
    {
      "name": "temperature",
      "value": 0.1
    }
  ]
}